{
  "fetched_at": "2026-04-09T05:55:24.959900+00:00",
  "structures": {
    "1AKE": {
      "pdb_title": "STRUCTURE OF THE COMPLEX BETWEEN ADENYLATE KINASE FROM ESCHERICHIA COLI AND THE INHIBITOR AP5A REFINED AT 1.9 ANGSTROMS RESOLUTION: A MODEL FOR A CATALYTIC TRANSITION STATE",
      "source": "togomcp:search_pdb_entity",
      "fetch_ok": true,
      "error": null
    },
    "4AKE": {
      "pdb_title": "Structure of the apo form of Escherichia coli adenylate kinase",
      "source": "togomcp:search_pdb_entity",
      "fetch_ok": true,
      "error": null
    }
  },
  "uniprot_mapping": {
    "pairs": [["1AKE", "P69441"], ["4AKE", "P69441"]],
    "source": "togomcp:togoid_convertId",
    "fetch_ok": true,
    "error": null
  },
  "uniprot_entries": {
    "P69441": {
      "protein_names": "Adenylate kinase (AK) (EC 2.7.4.3) (ATP-AMP transphosphorylase) (ATP:AMP phosphotransferase) (Adenylate monophosphate kinase)",
      "organism": "Escherichia coli (strain K12)",
      "source": "togomcp:search_uniprot_entity",
      "fetch_ok": true,
      "error": null
    }
  },
  "uniprot_sparql": {
    "P69441": {
      "function": "Catalyzes the reversible transfer of the terminal phosphate group between ATP and AMP.",
      "keywords": ["Kinase", "Nucleotide-binding", "ATP-binding", "Transferase"],
      "domains": [{"name": "Adenylate kinase", "range": "1-214"}],
      "source": "togomcp:run_sparql",
      "fetch_ok": true,
      "error": null
    }
  },
  "warnings": []
}
